rank,category,tool_type,occurrences,priority_level,problem_description,impact_summary,percentage_of_total_spacing
1,Elements Overlapping or Misaligning on Page/Section,Stack,77,Critical,Layout instability from improper stacking behaviors and inconsistent container configurations,Elements not correctly constrained within stacks causing overlapping and broken layouts,27.3%
2,Layout & Responsive Design Inconsistencies,Repeater,64,Critical,Repeater elements fail to align space or resize correctly,Overlapping content misaligned elements unexpected visual behavior,22.7%
3,Repeater-Specific Layout/Behavior Limitations,Repeater,42,High,Inherent limitations in repeater functionality affecting layout flexibility,Core tool cannot meet user layout requirements,14.9%
4,Overlapping Elements & Unwanted Spacing (Visual Clutter),Section Grid,37,High,Shifting/overlapping elements unwanted white space misaligned grids,Layout breaks especially on mobile due to grid constraints and layering errors,13.1%
5,Confusion/Misunderstanding of Repeater Functionality,Repeater,37,High,Users struggling to understand and properly implement repeater functionality,Tool design/usability preventing successful usage,13.1%
6,Difficulty Adjusting Grid/Cell Sizing & Structure,Section Grid,32,High,Cannot resize cells due to fixed/locked templates auto-sizing behaviors conflicting margin/padding,Grid structures causing unwanted white space overlapping elements,11.3%
7,Spacing Padding & Alignment Issues,Section Grid,27,High,Overlapping/misaligned cells excessive white space gaps/padding confusion,Grid structure breaks margin/padding controls not working,9.6%
8,Limitations with Specific Layout Components/Behaviors,Stack,21,High,Users having trouble creating and controlling stacking and layout effects,Tool-specific functionality gaps limiting user capabilities,7.4%
9,Grid Cell & Section Manipulation Difficulties,Section Grid,20,High,Significant challenges managing section grids and cells in Wix Studio,Core tool manipulation is difficult and unintuitive,7.1%
10,Grid System Limitations & Inflexibility,Section Grid,20,High,Users face significant limitations with Wix Studio's grid features,Fundamental tool design constraints,7.1%
11,Difficulty with Fine-Grained Control and Manipulation of Stacked Elements,Stack,18,Medium,Alignment and resizing challenges due to restrictive stack behaviors,Tool lacks precision controls needed for detailed work,6.4%
12,Unpredictable Spacing and Gaps,Stack,14,Medium,Excessive gaps and inconsistent spacing across layouts,Tool behavior is unpredictable and unreliable,5.0%
13,Confusion & Lack of Understanding of Layout Tools,Section Grid,14,Medium,Users face recurring problems with managing section grids and spacing,Tool design is not intuitive or learnable,5.0%
14,Difficulty Manipulating CSS Grid Elements & Dimensions,CSS Grid,8,Low,Users struggling with precision and control needed to adjust elements within CSS Grid layouts,Tool lacks adequate manipulation controls,2.8%
15,Lack of General Familiarity/Understanding with Layout & Design,General,7,Low,Users frequently struggle with basic manipulation of elements and proper alignment,Overall tool usability and design issues,2.5%
16,Difficulty with Core Layout Controls & Editor Functionality,Flex,7,Low,User struggles with fundamental interactions and controls within the editor's layout system,Core tool controls are problematic,2.5%
17,Flexbox & Responsive Layout Rendering Issues,Flex,5,Low,Overlapping elements misalignment unwanted white space in flexbox layouts,Visual distortions broken layouts,1.8%
18,Layout Tool Feature Parity & Flexibility Limitations,Flex,5,Low,User frustrations from perceived lack of consistent features between different editors,Tool feature gaps compared to alternatives,1.8%
19,App/Component-Specific Responsive & Customization Limitations,Flex,5,Low,Specific Wix applications or pre-built components lacking necessary customization,Tool customization capabilities are limited,1.8%
20,Need for Advanced/Custom Layouts or Features,General,4,Minor,Users requesting complex design functionalities not readily available through existing tools,Tool capability gaps for advanced use cases,1.4%
21,Specific Layout Tool Functionality Issues,General,2,Minor,Difficulties with specific functions within layout tools,Specific tool functionality problems,0.7%
22,Transition Difficulties & Learning Curve with Wix Studio,General,2,Minor,Users new to Wix Studio struggling to adapt to its design tools,Tool adoption and onboarding challenges,0.7% 